{
  "$schema": "https://json-schema.org/draft/2020-12/schema",
  "$id": "https://example.invalid/project-pack-factory/task-backlog.schema.json",
  "title": "Project Pack Task Backlog",
  "type": "object",
  "additionalProperties": false,
  "required": [
    "schema_version",
    "pack_id",
    "objective_id",
    "generated_at",
    "tasks"
  ],
  "properties": {
    "schema_version": {
      "const": "task-backlog/v1"
    },
    "pack_id": {
      "type": "string",
      "pattern": "^[a-z0-9][a-z0-9_-]*$"
    },
    "objective_id": {
      "type": "string",
      "pattern": "^[a-z0-9][a-z0-9_-]*$"
    },
    "generated_at": {
      "type": "string",
      "format": "date-time"
    },
    "tasks": {
      "type": "array",
      "minItems": 1,
      "items": {
        "$ref": "#/$defs/task"
      }
    }
  },
  "$defs": {
    "non_empty_string": {
      "type": "string",
      "minLength": 1
    },
    "non_empty_string_array": {
      "type": "array",
      "items": {
        "$ref": "#/$defs/non_empty_string"
      }
    },
    "task_id_array": {
      "type": "array",
      "uniqueItems": true,
      "items": {
        "type": "string",
        "pattern": "^[a-z0-9][a-z0-9_-]*$"
      }
    },
    "task": {
      "type": "object",
      "additionalProperties": false,
      "required": [
        "task_id",
        "summary",
        "status",
        "objective_link",
        "acceptance_criteria",
        "validation_commands",
        "files_in_scope",
        "dependencies",
        "blocked_by",
        "escalation_conditions",
        "completion_signals"
      ],
      "properties": {
        "task_id": {
          "type": "string",
          "pattern": "^[a-z0-9][a-z0-9_-]*$"
        },
        "summary": {
          "$ref": "#/$defs/non_empty_string"
        },
        "status": {
          "type": "string",
          "enum": [
            "pending",
            "in_progress",
            "blocked",
            "completed",
            "escalated",
            "cancelled"
          ]
        },
        "objective_link": {
          "type": "string",
          "pattern": "^[a-z0-9][a-z0-9_-]*$"
        },
        "acceptance_criteria": {
          "type": "array",
          "minItems": 1,
          "items": {
            "$ref": "#/$defs/non_empty_string"
          }
        },
        "validation_commands": {
          "type": "array",
          "minItems": 1,
          "items": {
            "$ref": "#/$defs/non_empty_string"
          }
        },
        "files_in_scope": {
          "type": "array",
          "minItems": 1,
          "items": {
            "$ref": "#/$defs/non_empty_string"
          }
        },
        "dependencies": {
          "$ref": "#/$defs/task_id_array"
        },
        "selection_priority": {
          "type": "number"
        },
        "selection_signals": {
          "$ref": "#/$defs/non_empty_string_array"
        },
        "blocked_by": {
          "$ref": "#/$defs/non_empty_string_array"
        },
        "escalation_conditions": {
          "type": "array",
          "minItems": 1,
          "items": {
            "$ref": "#/$defs/non_empty_string"
          }
        },
        "completion_signals": {
          "type": "array",
          "minItems": 1,
          "items": {
            "$ref": "#/$defs/non_empty_string"
          }
        }
      }
    }
  }
}
