{
  "generated_at": "2026-03-25T18:09:14Z",
  "objective_id": "json-health-checker-longer-backlog-build-pack-v3_objective",
  "pack_id": "json-health-checker-longer-backlog-build-pack-v3",
  "schema_version": "task-backlog/v1",
  "tasks": [
    {
      "acceptance_criteria": [
        "The validation readiness-evaluation workflow exits successfully.",
        "The validation gate records passing evidence in status/readiness.json."
      ],
      "blocked_by": [],
      "completion_signals": [
        "validate_build_pack_contract reaches pass state.",
        "Validation evaluation evidence is recorded under eval/history and linked from status/readiness.json."
      ],
      "dependencies": [],
      "escalation_conditions": [
        "Validation reports schema or contract failures that the current task scope cannot resolve safely."
      ],
      "files_in_scope": [
        "pack.json",
        "status/readiness.json",
        "eval/latest/index.json"
      ],
      "objective_link": "json-health-checker-longer-backlog-build-pack-v3_objective",
      "status": "completed",
      "summary": "Run the validation readiness-evaluation workflow and capture canonical validation evidence.",
      "task_id": "run_build_pack_validation",
      "validation_commands": [
        "python3 .packfactory-runtime/tools/run_build_pack_readiness_eval.py --pack-root . --mode validation-only --invoked-by autonomous-loop"
      ]
    },
    {
      "acceptance_criteria": [
        "The checkpoint helper exits successfully.",
        "A checkpoint artifact is written under eval/history."
      ],
      "blocked_by": [],
      "completion_signals": [
        "A checkpoint-result.json artifact is recorded under eval/history.",
        "Canonical work-state advances to the next task through the existing continuity workflow."
      ],
      "dependencies": [
        "run_build_pack_validation"
      ],
      "escalation_conditions": [
        "The checkpoint helper cannot read canonical state or write bounded evidence under eval/history."
      ],
      "files_in_scope": [
        "src/record_longer_backlog_progress.py",
        "eval/history",
        "status/work-state.json",
        "status/readiness.json"
      ],
      "objective_link": "json-health-checker-longer-backlog-build-pack-v3_objective",
      "status": "in_progress",
      "summary": "Record bounded continuity checkpoint evidence hop 1 after the current canonical task completes.",
      "task_id": "record_progress_checkpoint_01",
      "validation_commands": [
        "python3 src/record_longer_backlog_progress.py --pack-root . --task-id record_progress_checkpoint_01 --output json"
      ]
    },
    {
      "acceptance_criteria": [
        "The checkpoint helper exits successfully.",
        "A checkpoint artifact is written under eval/history."
      ],
      "blocked_by": [],
      "completion_signals": [
        "A checkpoint-result.json artifact is recorded under eval/history.",
        "Canonical work-state advances to the next task through the existing continuity workflow."
      ],
      "dependencies": [
        "record_progress_checkpoint_01"
      ],
      "escalation_conditions": [
        "The checkpoint helper cannot read canonical state or write bounded evidence under eval/history."
      ],
      "files_in_scope": [
        "src/record_longer_backlog_progress.py",
        "eval/history",
        "status/work-state.json",
        "status/readiness.json"
      ],
      "objective_link": "json-health-checker-longer-backlog-build-pack-v3_objective",
      "status": "pending",
      "summary": "Record bounded continuity checkpoint evidence hop 2 after the current canonical task completes.",
      "task_id": "record_progress_checkpoint_02",
      "validation_commands": [
        "python3 src/record_longer_backlog_progress.py --pack-root . --task-id record_progress_checkpoint_02 --output json"
      ]
    },
    {
      "acceptance_criteria": [
        "The benchmark readiness-evaluation workflow exits successfully.",
        "Inherited benchmark gates update from not_run to pass or waived."
      ],
      "blocked_by": [],
      "completion_signals": [
        "Benchmark evaluation evidence records results in eval/latest/index.json.",
        "Required benchmark gates advance to pass or waived in status/readiness.json."
      ],
      "dependencies": [
        "record_progress_checkpoint_02"
      ],
      "escalation_conditions": [
        "Benchmark output fails to update readiness or eval state through the existing bounded surfaces."
      ],
      "files_in_scope": [
        "benchmarks/active-set.json",
        "status/readiness.json",
        "eval/latest/index.json"
      ],
      "objective_link": "json-health-checker-longer-backlog-build-pack-v3_objective",
      "status": "pending",
      "summary": "Run the benchmark readiness-evaluation workflow after validation passes.",
      "task_id": "run_inherited_benchmarks",
      "validation_commands": [
        "python3 .packfactory-runtime/tools/run_build_pack_readiness_eval.py --pack-root . --mode benchmark-only --invoked-by autonomous-loop"
      ]
    }
  ]
}
