{
  "generated_at": "2026-03-25T17:19:40Z",
  "objective_id": "json-health-checker-one-pass-promotion-build-pack-v1_objective",
  "pack_id": "json-health-checker-one-pass-promotion-build-pack-v1",
  "schema_version": "task-backlog/v1",
  "tasks": [
    {
      "acceptance_criteria": [
        "The validation readiness-evaluation workflow exits successfully.",
        "The validation gate records passing evidence in status/readiness.json."
      ],
      "blocked_by": [],
      "completion_signals": [
        "validate_build_pack_contract reaches pass state.",
        "Validation evaluation evidence is recorded under eval/history and linked from status/readiness.json."
      ],
      "dependencies": [],
      "escalation_conditions": [
        "Validation reports schema or contract failures that the current task scope cannot resolve safely."
      ],
      "files_in_scope": [
        "pack.json",
        "status/readiness.json",
        "eval/latest/index.json"
      ],
      "objective_link": "json-health-checker-one-pass-promotion-build-pack-v1_objective",
      "status": "completed",
      "summary": "Run the validation readiness-evaluation workflow and capture canonical validation evidence.",
      "task_id": "run_build_pack_validation",
      "validation_commands": [
        "python3 .packfactory-runtime/tools/run_build_pack_readiness_eval.py --pack-root . --mode validation-only --invoked-by autonomous-loop"
      ]
    },
    {
      "acceptance_criteria": [
        "The benchmark readiness-evaluation workflow exits successfully.",
        "Inherited benchmark gates update from not_run to pass or waived."
      ],
      "blocked_by": [],
      "completion_signals": [
        "Benchmark evaluation evidence records results in eval/latest/index.json.",
        "Required benchmark gates advance to pass or waived in status/readiness.json."
      ],
      "dependencies": [
        "run_build_pack_validation"
      ],
      "escalation_conditions": [
        "Benchmark output fails to update readiness or eval state through the existing bounded surfaces."
      ],
      "files_in_scope": [
        "benchmarks/active-set.json",
        "status/readiness.json",
        "eval/latest/index.json"
      ],
      "objective_link": "json-health-checker-one-pass-promotion-build-pack-v1_objective",
      "status": "in_progress",
      "summary": "Run the benchmark readiness-evaluation workflow after validation passes.",
      "task_id": "run_inherited_benchmarks",
      "validation_commands": [
        "python3 .packfactory-runtime/tools/run_build_pack_readiness_eval.py --pack-root . --mode benchmark-only --invoked-by autonomous-loop"
      ]
    }
  ]
}
