{
  "generated_at": "2026-03-25T18:51:46Z",
  "objective_id": "json-health-checker-semantic-branch-build-pack-v1_objective",
  "pack_id": "json-health-checker-semantic-branch-build-pack-v1",
  "schema_version": "task-backlog/v1",
  "tasks": [
    {
      "acceptance_criteria": [
        "The validation readiness-evaluation workflow exits successfully.",
        "The validation gate records passing evidence in status/readiness.json."
      ],
      "blocked_by": [],
      "completion_signals": [
        "validate_build_pack_contract reaches pass state.",
        "Validation evaluation evidence is recorded under eval/history and linked from status/readiness.json."
      ],
      "dependencies": [],
      "escalation_conditions": [
        "Validation reports schema or contract failures that the current task scope cannot resolve safely."
      ],
      "files_in_scope": [
        "pack.json",
        "status/readiness.json",
        "eval/latest/index.json"
      ],
      "objective_link": "json-health-checker-semantic-branch-build-pack-v1_objective",
      "status": "completed",
      "summary": "Run the validation readiness-evaluation workflow and capture canonical validation evidence.",
      "task_id": "run_build_pack_validation",
      "validation_commands": [
        "python3 .packfactory-runtime/tools/run_build_pack_readiness_eval.py --pack-root . --mode validation-only --invoked-by autonomous-loop"
      ]
    },
    {
      "acceptance_criteria": [
        "The branch helper exits successfully for semantic branch alpha.",
        "A semantic branch checkpoint artifact is written under eval/history."
      ],
      "blocked_by": [],
      "completion_signals": [
        "A semantic-branch-checkpoint-result.json artifact is recorded under eval/history for semantic branch alpha.",
        "Canonical work-state advances after the semantic branch-alpha checkpoint completes."
      ],
      "dependencies": [
        "run_build_pack_validation"
      ],
      "escalation_conditions": [
        "The branch helper cannot read canonical state or write bounded evidence under eval/history."
      ],
      "files_in_scope": [
        "src/record_semantic_branch_progress.py",
        "eval/history",
        "status/work-state.json",
        "status/readiness.json"
      ],
      "objective_link": "json-health-checker-semantic-branch-build-pack-v1_objective",
      "selection_signals": [
        "operator",
        "reporting",
        "html",
        "narrative"
      ],
      "status": "completed",
      "summary": "Record operator-reporting checkpoint evidence after validation passes.",
      "task_id": "record_semantic_branch_alpha",
      "validation_commands": [
        "python3 src/record_semantic_branch_progress.py --pack-root . --task-id record_semantic_branch_alpha --branch-lane alpha --output json"
      ]
    },
    {
      "acceptance_criteria": [
        "The branch helper exits successfully for semantic branch beta.",
        "A semantic branch checkpoint artifact is written under eval/history."
      ],
      "blocked_by": [],
      "completion_signals": [
        "A semantic-branch-checkpoint-result.json artifact is recorded under eval/history for semantic branch beta.",
        "Canonical work-state advances after the semantic branch-beta checkpoint completes."
      ],
      "dependencies": [
        "run_build_pack_validation"
      ],
      "escalation_conditions": [
        "The branch helper cannot read canonical state or write bounded evidence under eval/history."
      ],
      "files_in_scope": [
        "src/record_semantic_branch_progress.py",
        "eval/history",
        "status/work-state.json",
        "status/readiness.json"
      ],
      "objective_link": "json-health-checker-semantic-branch-build-pack-v1_objective",
      "selection_signals": [
        "json",
        "schema",
        "validation",
        "integrity"
      ],
      "status": "completed",
      "summary": "Record schema-validation checkpoint evidence after validation passes.",
      "task_id": "record_semantic_branch_beta",
      "validation_commands": [
        "python3 src/record_semantic_branch_progress.py --pack-root . --task-id record_semantic_branch_beta --branch-lane beta --output json"
      ]
    },
    {
      "acceptance_criteria": [
        "The benchmark readiness-evaluation workflow exits successfully.",
        "Inherited benchmark gates update from not_run to pass or waived."
      ],
      "blocked_by": [],
      "completion_signals": [
        "Benchmark evaluation evidence records results in eval/latest/index.json.",
        "Required benchmark gates advance to pass or waived in status/readiness.json."
      ],
      "dependencies": [
        "record_semantic_branch_alpha",
        "record_semantic_branch_beta"
      ],
      "escalation_conditions": [
        "Benchmark output fails to update readiness or eval state through the existing bounded surfaces."
      ],
      "files_in_scope": [
        "benchmarks/active-set.json",
        "status/readiness.json",
        "eval/latest/index.json"
      ],
      "objective_link": "json-health-checker-semantic-branch-build-pack-v1_objective",
      "status": "completed",
      "summary": "Run the benchmark readiness-evaluation workflow after validation passes.",
      "task_id": "run_inherited_benchmarks",
      "validation_commands": [
        "python3 .packfactory-runtime/tools/run_build_pack_readiness_eval.py --pack-root . --mode benchmark-only --invoked-by autonomous-loop"
      ]
    }
  ]
}
